ID,name,description
b3d1f8a0-1234-4567-89ab-cdef01234567,Command & Operations,Responsible for mission oversight and strategic decision-making.
c4e2f9b1-2345-5678-9abc-def012345678,Engineering & Propulsion,Maintains the warp drive and life support systems.
d5f3a0c2-3456-6789-abcd-ef0123456789,Astroscience & Research,Conducts stellar mapping and planetary analysis.
e6a4b1d3-4567-789a-bcde-f0123456789a,Medical & Xenobiology,Handles crew health and extraterrestrial life studies.
f7b5c2e4-5678-89ab-cdef-0123456789ab,Tactical & Security,Ensures vessel safety and colonial defense.
